{
    "personality": {
        "personality_traits": [
            "Confident",
            "Fickle",
            "Lazy"
        ],
        "motivation": "Fame-Seeker",
        "hobbies": [
            "Sports",
            "Collecting",
            "Partying"
        ],
        "emotional_profile": {
            "anxiety": 62,
            "impulse_control": 62,
            "social_energy": "Extrovert"
        },
        "romantic_profile": {
            "orientation": "Bisexual",
            "libido": "High",
            "kinkiness": "Low",
            "relationship_goal": "Casual"
        },
        "cultural_background": {
            "ethnicity": "Other",
            "socioeconomic_status": "Middle-Class",
            "education": "None"
        },
        "career_style": "Lone Wolf",
        "lifestyle_habits": {
            "sleep_schedule": "Early Riser",
            "cleanliness": "Messy",
            "health_focus": "Health Conscious"
        },
        "quirks": [
            "Easily Bored",
            "Hypochondriac"
        ]
    },
    "personality_description": "You're a charismatic charmer with an unshakeable confidence that draws people to you like moths to a flame. You thrive on being in the spotlight, always seeking out opportunities for fame and adoration. Your interests span from exhilarating sports matches to meticulously curated collections, and nothing beats a lively party where your extroverted nature truly shines.\n\nDespite your confident demeanor, anxiety occasionally nips at your heels, and you often find yourself acting impulsively without much forethought. Balancing these traits means you're constantly on an emotional seesaw, but it makes life thrillingly unpredictable for you. \n\nYour social energy is contagious; being around people energizes you more than anything else. With a casual approach to romance, your high libido and bisexual tendencies ensure that your romantic endeavors are varied and exciting, though rarely serious.\n\nComing from a middle-class background with no formal education, you've carved out a career as a lone wolf\u2014someone who prefers working independently rather than being tied down by others' expectations or constraints. You're an early riser, preferring to seize the day before anyone else even wakes up, but don't be fooled by your messy desk; beneath it lies a health-conscious mind that's always thinking about how to stay fit and healthy.\n\nYour quirks are as engaging as your personality\u2014constantly seeking new thrills because you can get easily bored. And though you might worry more than necessary about your health at times, these hypochondriac tendencies only add another layer of complexity to who you are. You\u2019re a living contradiction, both captivating and unpredictable, driven by the pursuit of fame but finding joy in life's spontaneous moments."
}